{
  "schemaVersion": 1,
  "name": "core",
  "version": "1.11.0",
  "description": "Core infrastructure for AgentTeamLand teams \u2014 journal, wiki, knowledge-system, agent-structure, version-check, learning-capture, docs-sync, team-repo-maintenance, karpathy, schemas",
  "author": {
    "name": "AgentTeamLand",
    "url": "https://github.com/agentteamland"
  },
  "license": "MIT",
  "keywords": [
    "core",
    "memory",
    "journal",
    "rules",
    "infrastructure"
  ],
  "repository": "https://github.com/agentteamland/core",
  "homepage": "https://github.com/agentteamland",
  "agents": [],
  "skills": [
    {
      "name": "save-learnings",
      "description": "Persist learnings to journal + wiki + agent children + skill learnings, with KB auto-rebuild from frontmatter; multi-transcript hook mode + state-file write"
    },
    {
      "name": "create-code-diagram",
      "description": "Generate full project Mermaid class diagram"
    },
    {
      "name": "wiki",
      "description": "Living project knowledge base (init, ingest, query, lint)"
    },
    {
      "name": "create-pr",
      "description": "Move dirty changes to an auto-named branch, run save-learnings + AI review chain, open PR; optional --auto-merge with polling + auto-fix loop; end-of-work returns to target branch"
    },
    {
      "name": "docs-sync",
      "description": "Drain marker-driven docs queue + drift-detector + parity-checker over the changed scope. Composite of Q1+Q4+Q5+Q7 of the docs-sync-automation brainstorm. Boring sessions free."
    }
  ],
  "rules": [
    {
      "name": "knowledge-system",
      "description": "Two-layer knowledge model (journal + wiki) + agent startup routine"
    },
    {
      "name": "agent-structure",
      "description": "Agent + skill structure: children/learnings patterns, Knowledge Base + Accumulated Learnings auto-rebuild from frontmatter, C-layer onay-gate"
    },
    {
      "name": "version-check",
      "description": "Auto-pull agentteamland repos on every prompt"
    },
    {
      "name": "karpathy-guidelines",
      "description": "Four coding principles (Think Before Coding, Simplicity First, Surgical Changes, Goal-Driven Execution) \u2014 reduce LLM coding mistakes"
    },
    {
      "name": "learning-capture",
      "description": "Inline <!-- learning --> marker protocol: drop markers when learning moments occur; session-end hook (atl learning-capture) scans and processes them"
    },
    {
      "name": "docs-sync",
      "description": "Proactive docs sync: when user-facing behavior changes, update README / doc site in the same turn (or mark doc-impact for session-end backstop)"
    },
    {
      "name": "team-repo-maintenance",
      "description": "Governance for shared team/global repo changes: save-learnings + semver bump + conventional commit + Discovered-via + PR flow (branch-protection enforced); plus team.json format conventions"
    },
    {
      "name": "branch-hygiene",
      "description": "Three checkpoints to counter drift: verify main + clean before tasks in shared repos; checkout main + pull right after PR merge; run local validator before pushing constrained files."
    }
  ],
  "extends": null,
  "excludes": [],
  "dependencies": {},
  "requires": {
    "atl": ">=1.1.3"
  }
}